,BlackElo,ECO,Event,Opening,Result,Termination,TimeControl,WhiteElo,BlackTitle,WhiteTitle,Move_ply_200,Category,Opening_new,freq,ELO Diff,Ave ELO
148403,1804,C00,Rated Classical game,Rat Defense: Small Center Defense,1-0,Normal,900+15,1688,,,,Classical,Rat Defense,755,-116,1746.0
148439,1754,C69,Rated Classical game,"Ruy Lopez: Exchange Variation, Normal Variation",1-0,Normal,900+15,1716,,,,Classical,Ruy Lopez,6912,-38,1735.0
148460,1881,D20,Rated Classical game,Queen's Gambit Accepted,0-1,Normal,900+15,2013,,,,Classical,Queen's Gambit Accepted,2590,132,1947.0
148515,1886,B22,Rated Classical game,Sicilian Defense: Alapin Variation,1-0,Normal,900+15,1848,,,,Classical,Sicilian Defense,27238,-38,1867.0
148521,1689,A40,Rated Classical game,Horwitz Defense,1-0,Normal,900+15,1852,,,,Classical,Horwitz Defense,2191,163,1770.5
148568,1888,B20,Rated Classical game,Sicilian Defense: Wing Gambit,0-1,Normal,900+15,1943,,,,Classical,Sicilian Defense,27238,55,1915.5
148571,2131,B52,Rated Classical game,"Sicilian Defense: Canal-Sokolsky Attack, Sokolsky Variation",0-1,Normal,900+15,2110,,,,Classical,Sicilian Defense,27238,-21,2120.5
148614,1770,C61,Rated Classical game,Ruy Lopez: Bird Variation,0-1,Normal,900+15,1896,,,,Classical,Ruy Lopez,6912,126,1833.0
148671,1769,C01,Rated Classical game,French Defense: Exchange Variation,0-1,Normal,900+15,1738,,,,Classical,French Defense,13036,-31,1753.5
148695,1766,D20,Rated Classical game,Queen's Gambit Accepted: Old Variation,0-1,Normal,1800+0,1726,,,,Classical,Queen's Gambit Accepted,2590,-40,1746.0
148706,2010,A20,Rated Classical game,English Opening: King's English Variation,0-1,Normal,900+15,1750,,,,Classical,English Opening,7494,-260,1880.0
148745,1828,B01,Rated Classical game,Scandinavian Defense: Gubinsky-Melts Defense,0-1,Normal,900+15,1860,,,,Classical,Scandinavian Defense,7890,32,1844.0
148747,2114,E10,Rated Classical game,Indian Game: Anti-Nimzo-Indian,0-1,Normal,900+15,1967,,,,Classical,Indian Game,4090,-147,2040.5
148785,1757,C41,Rated Classical game,Philidor Defense,1-0,Normal,900+15,1689,,,,Classical,Philidor Defense,5391,-68,1723.0
148815,1694,C54,Rated Classical game,"Italian Game: Giuoco Piano, Greco's Attack",1-0,Normal,900+15,1886,,,,Classical,Italian Game,8617,192,1790.0
148850,1793,C50,Rated Classical game,Giuoco Piano,1-0,Normal,900+15,1789,,,,Classical,Giuoco Piano,759,-4,1791.0
148881,2155,A81,Rated Classical game,Dutch Defense: Semi-Leningrad Variation,1-0,Normal,900+15,2276,,,,Classical,Dutch Defense,1126,121,2215.5
149021,1821,B32,Rated Classical game,Sicilian Defense: Open,0-1,Normal,900+15,1764,,,,Classical,Sicilian Defense,27238,-57,1792.5
149071,1738,C45,Rated Classical game,Scotch Game,1-0,Normal,900+15,1784,,,,Classical,Scotch Game,4227,46,1761.0
149129,1824,B92,Rated Classical game,"Sicilian Defense: Najdorf Variation, Opocensky Variation",0-1,Time forfeit,900+15,1900,,,,Classical,Sicilian Defense,27238,76,1862.0
149133,1824,C01,Rated Classical game,French Defense: Exchange Variation,1-0,Time forfeit,900+15,1844,,,,Classical,French Defense,13036,20,1834.0
149151,1911,B34,Rated Classical game,"Sicilian Defense: Accelerated Dragon, Modern Variation",1-0,Normal,900+15,1933,,,,Classical,Sicilian Defense,27238,22,1922.0
149157,1717,C21,Rated Classical game,Center Game: von der Lasa Gambit,1-0,Time forfeit,900+15,1795,,,,Classical,Center Game,1393,78,1756.0
149173,1782,C53,Rated Classical game,"Italian Game: Classical Variation, Giuoco Pianissimo",0-1,Time forfeit,900+15,1775,,,,Classical,Italian Game,8617,-7,1778.5
149186,1965,A40,Rated Classical game,Mikenas Defense,1-0,Normal,900+15,1947,,,,Classical,Mikenas Defense,464,-18,1956.0
149221,2078,D55,Rated Classical game,"Queen's Gambit Declined: Neo-Orthodox Variation, Main Line",0-1,Normal,900+15,1764,,,,Classical,Queen's Gambit Declined,4145,-314,1921.0
149247,1945,B31,Rated Classical game,"Sicilian Defense: Nyezhmetdinov-Rossolimo Attack, Fianchetto Variation",0-1,Normal,900+15,1671,,,,Classical,Sicilian Defense,27238,-274,1808.0
149267,1728,C45,Rated Classical game,Scotch Game,1/2-1/2,Normal,900+15,1750,,,,Classical,Scotch Game,4227,22,1739.0
149273,1969,D41,Rated Classical game,"Queen's Gambit Declined: Semi-Tarrasch, 5.cxd5",1-0,Normal,900+15,2115,,,,Classical,Queen's Gambit Declined,4145,146,2042.0
149308,2192,B21,Rated Classical game,"Sicilian Defense: Smith-Morra Gambit Declined, Scandinavian Formation",0-1,Time forfeit,600+30,1816,,,,Classical,Sicilian Defense,27238,-376,2004.0
149313,1815,D21,Rated Classical game,Queen's Gambit Accepted: Rosenthal Variation,1-0,Normal,900+15,1786,,,,Classical,Queen's Gambit Accepted,2590,-29,1800.5
149369,1720,C02,Rated Classical game,"French Defense: Advance Variation, Euwe Variation",0-1,Normal,900+15,1725,,,,Classical,French Defense,13036,5,1722.5
149457,1698,C20,Rated Classical game,King's Pawn Game,1-0,Normal,900+15,1721,,,,Classical,King's Pawn Game,6903,23,1709.5
149485,1809,D10,Rated Classical game,Slav Defense,0-1,Normal,900+15,1729,,,,Classical,Slav Defense,2437,-80,1769.0
149494,1859,A16,Rated Classical game,"English Opening: Anglo-Indian Defense, Queen's Knight Variation",0-1,Normal,900+15,1949,,,,Classical,English Opening,7494,90,1904.0
149593,1785,D10,Rated Classical game,Slav Defense,0-1,Normal,1500+0,1717,,,,Classical,Slav Defense,2437,-68,1751.0
149597,1710,D10,Rated Classical game,Slav Defense,1-0,Time forfeit,900+15,1736,,,,Classical,Slav Defense,2437,26,1723.0
149621,2044,C85,Rated Classical game,"Ruy Lopez: Closed Variations, Delayed Exchange",0-1,Normal,900+15,1757,,,,Classical,Ruy Lopez,6912,-287,1900.5
149629,2204,B10,Rated Classical game,Caro-Kann Defense: Breyer Variation,1-0,Time forfeit,900+15,2140,,,,Classical,Caro-Kann Defense,6878,-64,2172.0
149630,1740,C41,Rated Classical game,Philidor Defense #2,0-1,Normal,900+15,1742,,,,Classical,Philidor Defense,5391,2,1741.0
149656,1786,A08,Rated Classical game,King's Indian Attack,1-0,Normal,900+15,1685,,,,Classical,King's Indian Attack,802,-101,1735.5
149753,1890,C20,Rated Classical game,King's Pawn Game: King's Head Opening #2,0-1,Normal,900+15,2050,,,,Classical,King's Pawn Game,6903,160,1970.0
149766,1858,D00,Rated Classical game,Queen's Pawn Game: Mason Attack,1-0,Normal,900+15,1922,,,,Classical,Queen's Pawn Game,13096,64,1890.0
149853,2160,B62,Rated Classical game,"Sicilian Defense: Richter-Rauzer Variation, Neo-Modern Variation, Early Deviations",0-1,Normal,1800+0,2008,,IM,,Classical,Sicilian Defense,27238,-152,2084.0
149918,2085,D06,Rated Classical game,"Queen's Gambit Refused: Chigorin Defense, Tartakower Gambit",0-1,Time forfeit,1800+30,1887,,,,Classical,Queen's Gambit Declined,2704,-198,1986.0
150049,1779,C01,Rated Classical game,French Defense: Exchange Variation,0-1,Normal,900+15,1718,,,,Classical,French Defense,13036,-61,1748.5
150086,1714,A45,Rated Classical game,Trompowsky Attack,1-0,Normal,3600+5,1972,,,,Classical,Trompowsky Attack,422,258,1843.0
150097,1775,A00,Rated Classical game,Kadas Opening,0-1,Normal,900+15,1775,,,,Classical,Kadas Opening,206,0,1775.0
150143,1885,C50,Rated Classical game,Italian Game: Hungarian Defense,1/2-1/2,Normal,900+15,1856,,,,Classical,Italian Game,8617,-29,1870.5
150148,1706,C40,Rated Classical game,Latvian Gambit: Mason Countergambit,1-0,Normal,900+15,1707,,,,Classical,Latvian Gambit,175,1,1706.5
150177,1783,B50,Rated Classical game,Sicilian Defense,0-1,Normal,900+15,1866,,,,Classical,Sicilian Defense,27238,83,1824.5
150197,1737,C68,Rated Classical game,Ruy Lopez: Exchange Variation,1-0,Normal,1800+0,1721,,,,Classical,Ruy Lopez,6912,-16,1729.0
150308,1929,C10,Rated Classical game,"French Defense: Rubinstein Variation, Blackburne Defense",1-0,Normal,900+15,1813,,,,Classical,French Defense,13036,-116,1871.0
150409,1912,A15,Rated Classical game,English Opening: Anglo-Indian Defense,1-0,Normal,900+15,2050,,,,Classical,English Opening,7494,138,1981.0
150448,1765,C01,Rated Classical game,"French Defense: Winawer Variation, Delayed Exchange Variation",1-0,Normal,900+15,1682,,,,Classical,French Defense,13036,-83,1723.5
150450,1920,B21,Rated Classical game,Sicilian Defense: McDonnell Attack,0-1,Normal,900+15,1856,,,,Classical,Sicilian Defense,27238,-64,1888.0
150457,1633,A36,Rated Classical game,"English Opening: Symmetrical Variation, Botvinnik System Reversed",1-0,Normal,900+15,1829,,,,Classical,English Opening,7494,196,1731.0
150473,1736,C50,Rated Classical game,Italian Game,1/2-1/2,Normal,900+15,1725,,,,Classical,Italian Game,8617,-11,1730.5
150506,1827,D02,Rated Classical game,Queen's Pawn Game: Zukertort Variation,0-1,Normal,900+15,1772,,,,Classical,Queen's Pawn Game,13096,-55,1799.5
150581,2278,C42,Rated Classical game,"Russian Game: Classical Attack, Chigorin Variation, Main Line",0-1,Normal,900+15,2071,,,,Classical,Russian Game,2640,-207,2174.5
150587,1870,B53,Rated Classical game,Sicilian Defense: Chekhover Variation,1-0,Normal,900+15,1825,,,,Classical,Sicilian Defense,27238,-45,1847.5
150597,1894,C03,Rated Classical game,"French Defense: Tarrasch Variation, Guimard Defense",1-0,Normal,900+15,1860,,,,Classical,French Defense,13036,-34,1877.0
150642,1663,C20,Rated Classical game,English Opening: The Whale,1-0,Normal,900+15,1841,,,,Classical,English Opening,7494,178,1752.0
150647,1804,D00,Rated Classical game,Queen's Pawn Game: Mason Attack,1-0,Normal,900+15,1981,,,,Classical,Queen's Pawn Game,13096,177,1892.5
150651,1721,C41,Rated Classical game,Philidor Defense #3,1-0,Normal,900+15,1751,,,,Classical,Philidor Defense,5391,30,1736.0
150723,2066,B38,Rated Classical game,"Sicilian Defense: Accelerated Dragon, Maróczy Bind",1-0,Normal,1800+6,2190,,,,Classical,Sicilian Defense,27238,124,2128.0
150735,1777,B07,Rated Classical game,Pirc Defense #3,0-1,Normal,900+15,1830,,,,Classical,Pirc Defense,2814,53,1803.5
150754,1843,B01,Rated Classical game,Scandinavian Defense,0-1,Normal,900+15,1830,,,,Classical,Scandinavian Defense,7890,-13,1836.5
150785,1800,A41,Rated Classical game,Old Indian Defense,0-1,Normal,900+15,1818,,,,Classical,Old Indian Defense,506,18,1809.0
150818,1786,B40,Rated Classical game,"Sicilian Defense: French Variation, Open",0-1,Normal,900+15,1752,,,,Classical,Sicilian Defense,27238,-34,1769.0
150833,1916,A04,Rated Classical game,Polish Opening: Zukertort System,1-0,Normal,900+15,1818,,,,Classical,Polish Opening,733,-98,1867.0
150843,1851,A23,Rated Classical game,"English Opening: King's English Variation, Two Knights Variation, Keres Variation",1/2-1/2,Normal,900+15,1788,,,,Classical,English Opening,7494,-63,1819.5
150854,1928,B01,Rated Classical game,Scandinavian Defense: Classical Variation,0-1,Time forfeit,900+15,1768,,,,Classical,Scandinavian Defense,7890,-160,1848.0
150859,1784,A10,Rated Classical game,English Opening: Great Snake Variation,1-0,Normal,900+15,1839,,,,Classical,English Opening,7494,55,1811.5
150931,1794,A81,Rated Classical game,Dutch Defense: Fianchetto Attack,1-0,Normal,900+15,1818,,,,Classical,Dutch Defense,1126,24,1806.0
150969,1791,B11,Rated Classical game,"Caro-Kann Defense: Two Knights Attack, Mindeno Variation, Exchange Line",1-0,Normal,900+15,1785,,,,Classical,Caro-Kann Defense,6878,-6,1788.0
151100,1868,D37,Rated Classical game,Queen's Gambit Declined: Three Knights Variation,1-0,Normal,900+15,1973,,,,Classical,Queen's Gambit Declined,4145,105,1920.5
151135,1856,E91,Rated Classical game,King's Indian Defense: Orthodox Variation,1-0,Normal,900+15,1914,,,,Classical,King's Indian Defense,2170,58,1885.0
151194,1711,B12,Rated Classical game,Caro-Kann Defense: Advance Variation,1-0,Normal,900+15,1896,,,,Classical,Caro-Kann Defense,6878,185,1803.5
151208,1713,C70,Rated Classical game,Ruy Lopez,1-0,Normal,900+15,1825,,,,Classical,Ruy Lopez,6912,112,1769.0
151216,1751,E62,Rated Classical game,"King's Indian Defense: Fianchetto Variation, Lesser Simagin (Spassky)",1-0,Normal,1200+8,1727,,,,Classical,King's Indian Defense,2170,-24,1739.0
151224,1811,B21,Rated Classical game,Sicilian Defense: McDonnell Attack,1-0,Normal,900+15,1810,,,,Classical,Sicilian Defense,27238,-1,1810.5
151250,1844,C50,Rated Classical game,Italian Game: Hungarian Defense,1-0,Normal,900+15,1710,,,,Classical,Italian Game,8617,-134,1777.0
151267,1756,D00,Rated Classical game,Queen's Pawn Game: Mason Attack,1-0,Normal,900+15,1682,,,,Classical,Queen's Pawn Game,13096,-74,1719.0
151294,1653,C45,Rated Classical game,Scotch Game: Classical Variation,0-1,Normal,900+15,1810,,,,Classical,Scotch Game,4227,157,1731.5
151309,1925,C45,Rated Classical game,Scotch Game: Schmidt Variation,1-0,Normal,900+15,1831,,,,Classical,Scotch Game,4227,-94,1878.0
151312,1853,A00,Rated Classical game,Saragossa Opening,1-0,Normal,1500+10,1948,,,,Classical,Saragossa Opening,513,95,1900.5
151352,1932,B15,Rated Classical game,Caro-Kann Defense,1-0,Normal,900+15,1720,,,,Classical,Caro-Kann Defense,6878,-212,1826.0
151384,1776,B30,Rated Classical game,Sicilian Defense: Nyezhmetdinov-Rossolimo Attack,1-0,Normal,900+15,2102,,,,Classical,Sicilian Defense,27238,326,1939.0
151385,1844,B25,Rated Classical game,Sicilian Defense: Closed,1-0,Normal,900+15,1943,,,,Classical,Sicilian Defense,27238,99,1893.5
151443,1720,C28,Rated Classical game,Vienna Game: Vienna Gambit,0-1,Normal,900+15,2029,,,,Classical,Vienna Game,1849,309,1874.5
151452,1866,D30,Rated Classical game,Queen's Gambit Declined,1-0,Normal,2100+0,1899,,,,Classical,Queen's Gambit Declined,4145,33,1882.5
151482,2000,C41,Rated Classical game,Philidor Defense #2,0-1,Normal,900+15,1921,,,,Classical,Philidor Defense,5391,-79,1960.5
151497,1942,B03,Rated Classical game,Alekhine Defense: Exchange Variation,0-1,Time forfeit,900+15,1707,,,,Classical,Alekhine Defense,2101,-235,1824.5
151523,1814,C60,Rated Classical game,Ruy Lopez,1-0,Normal,1800+0,1835,,,,Classical,Ruy Lopez,6912,21,1824.5
151549,1761,A04,Rated Classical game,Zukertort Opening: Sicilian Invitation,0-1,Normal,900+15,1722,,,,Classical,Zukertort Opening,3388,-39,1741.5
151608,2191,B21,Rated Classical game,"Sicilian Defense: Smith-Morra Gambit Accepted, Paulsen Formation",0-1,Normal,900+15,2048,,,,Classical,Sicilian Defense,27238,-143,2119.5
151609,1914,B54,Rated Classical game,Sicilian Defense #2,1-0,Normal,900+15,2097,,,,Classical,Sicilian Defense,27238,183,2005.5
151640,1688,C55,Rated Classical game,"Italian Game: Two Knights Defense, Modern Bishop's Opening",1-0,Normal,900+15,1933,,,,Classical,Italian Game,8617,245,1810.5
151661,2155,B45,Rated Classical game,Sicilian Defense: Four Knights Variation,0-1,Normal,900+15,2122,,,,Classical,Sicilian Defense,27238,-33,2138.5
151676,1713,D04,Rated Classical game,"Queen's Pawn Game: Colle System, Anti-Colle",1-0,Normal,900+15,1722,,,,Classical,Queen's Pawn Game,13096,9,1717.5
151838,1956,A00,Rated Classical game,"Grob Opening: Grob Gambit, Fritz Gambit",0-1,Normal,900+15,1779,,,,Classical,Grob Opening,476,-177,1867.5
151845,2010,A22,Rated Classical game,"English Opening: King's English Variation, Two Knights Variation",1-0,Normal,1140+9,1451,,,,Classical,English Opening,7494,-559,1730.5
151909,1715,D31,Rated Classical game,Queen's Gambit Declined: Queen's Knight Variation,1-0,Normal,1800+5,1822,,,,Classical,Queen's Gambit Declined,4145,107,1768.5
151911,2105,D15,Rated Classical game,Slav Defense: Three Knights Variation,1-0,Normal,1800+5,2166,,,,Classical,Slav Defense,2437,61,2135.5
151939,1719,B02,Rated Classical game,Alekhine Defense: Scandinavian Variation,0-1,Normal,900+15,1749,,,,Classical,Alekhine Defense,2101,30,1734.0
151965,1684,D10,Rated Classical game,Slav Defense #2,1-0,Normal,1800+0,1785,,,,Classical,Slav Defense,2437,101,1734.5
151997,1925,C68,Rated Classical game,Ruy Lopez: Exchange Variation,0-1,Time forfeit,900+15,1823,,,,Classical,Ruy Lopez,6912,-102,1874.0
152027,1790,E90,Rated Classical game,King's Indian Defense: Zinnowitz Variation,0-1,Normal,900+15,1759,,,,Classical,King's Indian Defense,2170,-31,1774.5
152053,1898,B27,Rated Classical game,Sicilian Defense: Hyperaccelerated Dragon,0-1,Normal,900+15,1850,,,,Classical,Sicilian Defense,27238,-48,1874.0
152121,2085,A10,Rated Classical game,English Opening: Anglo-Dutch Defense,1/2-1/2,Normal,900+15,2254,,,,Classical,English Opening,7494,169,2169.5
152123,1970,D02,Rated Classical game,Queen's Pawn Game: Chigorin Variation,1-0,Normal,900+15,1939,,,,Classical,Queen's Pawn Game,13096,-31,1954.5
152130,1752,C25,Rated Classical game,Vienna Game: Zhuravlev Countergambit #2,0-1,Normal,900+15,1666,,,,Classical,Vienna Game,1849,-86,1709.0
152139,1768,B06,Rated Classical game,Robatsch (Modern) Defense,1-0,Normal,900+15,1703,,,,Classical,Robatsch (Modern) Defense,867,-65,1735.5
152158,1981,C21,Rated Classical game,Danish Gambit,0-1,Normal,900+15,2015,,,,Classical,Danish Gambit,349,34,1998.0
152165,1706,B10,Rated Classical game,Caro-Kann Defense,1-0,Normal,900+15,1721,,,,Classical,Caro-Kann Defense,6878,15,1713.5
152180,1788,C47,Rated Classical game,Four Knights Game: Scotch Variation Accepted,1-0,Normal,900+15,1796,,,,Classical,Four Knights Game,3524,8,1792.0
152226,1724,C65,Rated Classical game,Ruy Lopez: Berlin Defense #2,1-0,Normal,900+15,1719,,,,Classical,Ruy Lopez,6912,-5,1721.5
152229,1774,C01,Rated Classical game,French Defense: Exchange Variation,1-0,Normal,900+15,1740,,,,Classical,French Defense,13036,-34,1757.0
152231,2039,D05,Rated Classical game,Colle System: Traditional Colle,1-0,Normal,900+15,2039,,,,Classical,Colle System,352,0,2039.0
152294,2062,C02,Rated Classical game,French Defense: Advance Variation,0-1,Normal,900+15,1962,,,,Classical,French Defense,13036,-100,2012.0
152309,2045,A04,Rated Classical game,Zukertort Opening: Dutch Variation,1-0,Normal,2700+45,2481,,IM,,Classical,Zukertort Opening,3388,436,2263.0
152356,1757,C40,Rated Classical game,King's Pawn Game: Damiano Defense,0-1,Normal,900+15,1739,,,,Classical,King's Pawn Game,6903,-18,1748.0
152360,1790,B21,Rated Classical game,"Sicilian Defense: Smith-Morra Gambit Accepted, Paulsen Formation",1-0,Normal,1800+5,1780,,,,Classical,Sicilian Defense,27238,-10,1785.0
152366,1694,B21,Rated Classical game,Sicilian Defense: Smith-Morra Gambit,1-0,Time forfeit,900+15,1727,,,,Classical,Sicilian Defense,27238,33,1710.5
152396,1943,C01,Rated Classical game,French Defense: Exchange Variation,0-1,Normal,1800+1,1634,,,,Classical,French Defense,13036,-309,1788.5
152460,1807,A00,Rated Classical game,Hungarian Opening,0-1,Normal,900+15,1778,,,,Classical,Hungarian Opening,2313,-29,1792.5
152568,1755,B50,Rated Classical game,Sicilian Defense,0-1,Normal,900+15,1709,,,,Classical,Sicilian Defense,27238,-46,1732.0
152686,1953,A42,Rated Classical game,Sicilian Defense: Hyperaccelerated Fianchetto,1-0,Normal,900+15,2106,,,,Classical,Sicilian Defense,27238,153,2029.5
152719,1746,D10,Rated Classical game,Slav Defense,0-1,Normal,900+15,1800,,,,Classical,Slav Defense,2437,54,1773.0
152794,1647,C25,Rated Classical game,Vienna Game: Zhuravlev Countergambit #2,1-0,Normal,900+15,1883,,,,Classical,Vienna Game,1849,236,1765.0
152815,1738,C50,Rated Classical game,Italian Game: Schilling-Kostic Gambit,0-1,Normal,900+15,1867,,,,Classical,Italian Game,8617,129,1802.5
152901,1946,C41,Rated Classical game,Philidor Defense #3,1-0,Normal,900+15,1901,,,,Classical,Philidor Defense,5391,-45,1923.5
152932,1889,B18,Rated Classical game,Caro-Kann Defense: Classical Variation,1-0,Normal,900+15,1877,,,,Classical,Caro-Kann Defense,6878,-12,1883.0
152947,1832,C11,Rated Classical game,"French Defense: Classical Variation, Delayed Exchange Variation",1-0,Normal,900+15,1760,,,,Classical,French Defense,13036,-72,1796.0
152996,1846,A84,Rated Classical game,Dutch Defense: Rubinstein Variation,0-1,Normal,900+15,1947,,,,Classical,Dutch Defense,1126,101,1896.5
153026,1983,C40,Rated Classical game,Elephant Gambit: Paulsen Countergambit,0-1,Normal,900+15,1799,,,,Classical,Elephant Gambit,549,-184,1891.0
153033,2262,A10,Rated Classical game,English Opening: Great Snake Variation,0-1,Normal,1800+10,1803,FM,,,Classical,English Opening,7494,-459,2032.5
153050,1885,C11,Rated Classical game,"French Defense: Classical Variation, Steinitz Variation",0-1,Normal,900+15,1638,,,,Classical,French Defense,13036,-247,1761.5
153070,1681,B53,Rated Classical game,Sicilian Defense: Chekhover Variation,1-0,Time forfeit,2700+15,1830,,,,Classical,Sicilian Defense,27238,149,1755.5
153148,2076,A10,Rated Classical game,English Opening,0-1,Normal,900+15,1941,,,,Classical,English Opening,7494,-135,2008.5
153169,1761,B10,Rated Classical game,Caro-Kann Defense,1-0,Normal,900+15,1864,,,,Classical,Caro-Kann Defense,6878,103,1812.5
153179,1759,C46,Rated Classical game,Three Knights Opening,1-0,Normal,900+15,1743,,,,Classical,Three Knights Opening,1268,-16,1751.0
153238,1906,B22,Rated Classical game,Sicilian Defense: Alapin Variation,1-0,Normal,900+15,1839,,,,Classical,Sicilian Defense,27238,-67,1872.5
153239,1764,B10,Rated Classical game,Caro-Kann Defense,1-0,Normal,900+15,1747,,,,Classical,Caro-Kann Defense,6878,-17,1755.5
153247,1855,C11,Rated Classical game,"French Defense: Classical Variation, Steinitz Variation",0-1,Time forfeit,900+15,1787,,,,Classical,French Defense,13036,-68,1821.0
153277,1697,E00,Rated Classical game,Indian Game: East Indian Defense,0-1,Normal,900+15,1729,,,,Classical,Indian Game,4090,32,1713.0
153366,2145,B33,Rated Classical game,Sicilian Defense: Lasker-Pelikan Variation,0-1,Normal,900+15,2134,,,,Classical,Sicilian Defense,27238,-11,2139.5
153401,1773,C45,Rated Classical game,Scotch Game,0-1,Normal,900+15,1896,,,,Classical,Scotch Game,4227,123,1834.5
153439,1818,A08,Rated Classical game,King's Indian Attack: French Variation,1-0,Normal,900+15,2155,,,,Classical,King's Indian Attack,802,337,1986.5
153480,1791,B06,Rated Classical game,Modern Defense,1-0,Normal,1800+0,1730,,,,Classical,Modern Defense,3666,-61,1760.5
153489,1832,D00,Rated Classical game,Queen's Pawn Game: Mason Attack,1-0,Normal,900+15,1795,,,,Classical,Queen's Pawn Game,13096,-37,1813.5
153584,1749,A15,Rated Classical game,English Opening: Anglo-Indian Defense,1-0,Normal,900+15,1805,,,,Classical,English Opening,7494,56,1777.0
153615,1916,C44,Rated Classical game,King's Pawn Game: Dresden Opening,0-1,Normal,900+15,1635,,,,Classical,King's Pawn Game,6903,-281,1775.5
153645,1887,A31,Rated Classical game,"English Opening: Symmetrical Variation, Anti-Benoni Variation",1-0,Normal,900+15,1781,,,,Classical,English Opening,7494,-106,1834.0
153702,1754,C02,Rated Classical game,"French Defense: Advance Variation, Paulsen Attack",0-1,Normal,900+15,1765,,,,Classical,French Defense,13036,11,1759.5
153800,1691,B34,Rated Classical game,Sicilian Defense: Accelerated Dragon,1-0,Normal,900+15,1728,,,,Classical,Sicilian Defense,27238,37,1709.5
153811,2031,A43,Rated Classical game,"Benoni Defense: Benoni-Indian Defense, Kingside Move Order",1-0,Normal,900+15,1973,,,,Classical,Benoni Defense,1124,-58,2002.0
153858,1807,C44,Rated Classical game,King's Knight Opening: Normal Variation,0-1,Time forfeit,900+15,1766,,,,Classical,King's Knight Opening,1113,-41,1786.5
153935,1861,B90,Rated Classical game,Sicilian Defense: Najdorf Variation,1-0,Normal,900+15,1807,,,,Classical,Sicilian Defense,27238,-54,1834.0
153938,1716,C20,Rated Classical game,King's Pawn Opening: 2.b3,1-0,Normal,900+15,1690,,,,Classical,King's Pawn Game,143,-26,1703.0
153946,1677,B20,Rated Classical game,Sicilian Defense: Bowdler Attack,0-1,Normal,900+15,1748,,,,Classical,Sicilian Defense,27238,71,1712.5
154025,1768,C64,Rated Classical game,"Ruy Lopez: Classical Variation, Central Variation",1/2-1/2,Normal,900+15,1739,,,,Classical,Ruy Lopez,6912,-29,1753.5
154048,1927,D10,Rated Classical game,Slav Defense #2,1/2-1/2,Normal,900+15,1905,,,,Classical,Slav Defense,2437,-22,1916.0
154096,1719,B18,Rated Classical game,Caro-Kann Defense: Classical Variation,1-0,Normal,900+15,1854,,,,Classical,Caro-Kann Defense,6878,135,1786.5
154121,1726,B33,Rated Classical game,Sicilian Defense: Lasker-Pelikan Variation,0-1,Normal,900+15,1851,,,,Classical,Sicilian Defense,27238,125,1788.5
154208,1916,C53,Rated Classical game,Italian Game: Classical Variation #2,1-0,Normal,900+15,1904,,,,Classical,Italian Game,8617,-12,1910.0
154229,1795,E90,Rated Classical game,"King's Indian Defense: Normal Variation, Rare Defenses",0-1,Normal,900+15,1775,,,,Classical,King's Indian Defense,2170,-20,1785.0
154234,2143,E15,Rated Classical game,"Queen's Indian Defense: Fianchetto Variation, Sämisch Variation",0-1,Normal,900+15,1817,,,,Classical,Queen's Indian Defense,220,-326,1980.0
154241,1763,C01,Rated Classical game,French Defense: Exchange Variation,0-1,Normal,1800+0,1639,,,,Classical,French Defense,13036,-124,1701.0
154298,1786,C10,Rated Classical game,French Defense: Paulsen Variation,0-1,Normal,900+15,1723,,,,Classical,French Defense,13036,-63,1754.5
154372,1735,A35,Rated Classical game,"English Opening: Symmetrical Variation, Four Knights Variation",1-0,Normal,900+15,1738,,,,Classical,English Opening,7494,3,1736.5
154415,1899,B20,Rated Classical game,Sicilian Defense,0-1,Normal,1800+0,1805,,,,Classical,Sicilian Defense,27238,-94,1852.0
154521,1791,B30,Rated Classical game,Sicilian Defense: Old Sicilian,1-0,Normal,900+15,1709,,,,Classical,Sicilian Defense,27238,-82,1750.0
154599,1849,D06,Rated Classical game,Queen's Gambit Refused: Marshall Defense,0-1,Normal,900+15,1883,,,,Classical,Queen's Gambit Declined,2704,34,1866.0
154615,1794,C00,Rated Classical game,French Defense: Knight Variation,1-0,Normal,900+15,1712,,,,Classical,French Defense,13036,-82,1753.0
154681,1773,B20,Rated Classical game,Sicilian Defense: Staunton-Cochrane Variation,1-0,Normal,900+15,1806,,,,Classical,Sicilian Defense,27238,33,1789.5
154712,1900,D08,Rated Classical game,"Queen's Gambit Refused: Albin Countergambit, Lasker Trap",1-0,Normal,900+15,1868,,,,Classical,Queen's Gambit Declined,2704,-32,1884.0
