,BlackElo,ECO,Event,Opening,Result,Termination,TimeControl,WhiteElo,BlackTitle,WhiteTitle,Move_ply_200,Category,Opening_new,freq,ELO Diff,Ave ELO
95180,1888,B50,Rated Classical game,Sicilian Defense: Delayed Alapin,0-1,Normal,1500+0,1679,,,,Classical,Sicilian Defense,27238,-209,1783.5
95196,2218,B30,Rated Classical game,Sicilian Defense: Old Sicilian,0-1,Normal,900+15,1843,,,,Classical,Sicilian Defense,27238,-375,2030.5
95203,1759,C55,Rated Classical game,Italian Game: Anti-Fried Liver Defense,0-1,Normal,900+15,1707,,,,Classical,Italian Game,8617,-52,1733.0
95210,1929,B10,Rated Classical game,Caro-Kann Defense,0-1,Normal,1500+5,1833,,,,Classical,Caro-Kann Defense,6878,-96,1881.0
95356,2127,B31,Rated Classical game,"Sicilian Defense: Nyezhmetdinov-Rossolimo Attack, Fianchetto Variation",1-0,Normal,900+15,1861,,,,Classical,Sicilian Defense,27238,-266,1994.0
95381,1672,C50,Rated Classical game,Italian Game,1-0,Normal,900+15,1750,,,,Classical,Italian Game,8617,78,1711.0
95442,1838,C34,Rated Classical game,"King's Gambit Accepted, Fischer Defense",0-1,Normal,900+15,1768,,,,Classical,King's Gambit Accepted,1706,-70,1803.0
95490,1879,B32,Rated Classical tournament https://lichess.org/tournament/Ri4nH8Lk,Sicilian Defense: Open #3,0-1,Time forfeit,1200+10,1939,,,,Classical,Sicilian Defense,27238,60,1909.0
95598,2005,C00,Rated Classical game,French Defense: Knight Variation,0-1,Normal,900+15,1837,,,,Classical,French Defense,13036,-168,1921.0
95603,1666,B22,Rated Classical game,Sicilian Defense: Alapin Variation,0-1,Normal,900+15,1863,,,,Classical,Sicilian Defense,27238,197,1764.5
95632,1955,A58,Rated Classical game,"Benko Gambit Accepted, Fully Accepted Variation",0-1,Normal,900+15,1936,,,,Classical,Benko Gambit Accepted,113,-19,1945.5
95688,1864,B27,Rated Classical game,Sicilian Defense: Hyperaccelerated Dragon,1-0,Normal,900+15,1837,,,,Classical,Sicilian Defense,27238,-27,1850.5
95716,1906,A21,Rated Classical game,"English Opening: King's English Variation, Reversed Sicilian",1-0,Normal,900+15,1805,,,,Classical,English Opening,7494,-101,1855.5
95723,1741,D05,Rated Classical game,Colle System #2,1-0,Time forfeit,900+15,1771,,,,Classical,Colle System,352,30,1756.0
95754,1831,B27,Rated Classical game,Sicilian Defense: Hyperaccelerated Dragon,0-1,Time forfeit,900+15,1698,,,,Classical,Sicilian Defense,27238,-133,1764.5
95800,1648,C60,Rated Classical game,Ruy Lopez: Lucena Variation,1-0,Normal,900+15,1770,,,,Classical,Ruy Lopez,6912,122,1709.0
95829,1904,B21,Rated Classical game,Sicilian Defense: McDonnell Attack,1-0,Normal,900+15,1877,,,,Classical,Sicilian Defense,27238,-27,1890.5
95830,1970,B07,Rated Classical game,Pirc Defense #5,1-0,Normal,900+15,1967,,,,Classical,Pirc Defense,2814,-3,1968.5
95875,1852,D00,Rated Classical game,Queen's Pawn Game: Mason Attack,0-1,Time forfeit,900+15,1939,,,,Classical,Queen's Pawn Game,13096,87,1895.5
95910,2029,C23,Rated Classical game,Bishop's Opening: Calabrese Countergambit,1-0,Normal,900+15,1822,,,,Classical,Bishop's Opening,2817,-207,1925.5
95913,1789,B30,Rated Classical game,Sicilian Defense: Nyezhmetdinov-Rossolimo Attack,1-0,Normal,900+15,1836,,,,Classical,Sicilian Defense,27238,47,1812.5
95917,1627,B52,Rated Classical game,"Sicilian Defense: Canal Attack, Main Line",1-0,Normal,900+15,1920,,,,Classical,Sicilian Defense,27238,293,1773.5
95919,1847,C70,Rated Classical game,"Ruy Lopez: Morphy Defense, Caro Variation",0-1,Normal,900+15,1802,,,,Classical,Ruy Lopez,6912,-45,1824.5
95964,1755,D02,Rated Classical game,Queen's Pawn Game: London System,1/2-1/2,Normal,900+15,1733,,,,Classical,Queen's Pawn Game,13096,-22,1744.0
95998,1715,B33,Rated Classical game,Sicilian Defense: Lasker-Pelikan Variation,1-0,Normal,900+15,1751,,,,Classical,Sicilian Defense,27238,36,1733.0
96026,1788,E12,Rated Classical game,Queen's Indian Defense: Kasparov Variation,0-1,Normal,900+15,1780,,,,Classical,Queen's Indian Defense,220,-8,1784.0
96130,1959,D03,Rated Classical game,Queen's Pawn Game: Torre Attack,1-0,Normal,900+15,2096,,,,Classical,Queen's Pawn Game,13096,137,2027.5
96150,1772,C17,Rated Classical game,"French Defense: Winawer Variation, Advance Variation",1-0,Normal,900+15,1831,,,,Classical,French Defense,13036,59,1801.5
96173,1695,A46,Rated Classical game,Torre Attack #2,0-1,Normal,1800+0,1890,,,,Classical,Torre Attack,394,195,1792.5
96203,1785,C45,Rated Classical game,Scotch Game,1-0,Normal,900+15,1869,,,,Classical,Scotch Game,4227,84,1827.0
96214,1891,D30,Rated Classical game,Queen's Gambit Declined: Traditional Variation,0-1,Normal,900+15,1676,,,,Classical,Queen's Gambit Declined,4145,-215,1783.5
96247,1792,E20,Rated Classical game,Nimzo-Indian Defense,0-1,Normal,900+15,1738,,,,Classical,Nimzo-Indian Defense,1319,-54,1765.0
96264,1819,B20,Rated Classical game,Sicilian Defense: Bowdler Attack,0-1,Normal,900+15,1745,,,,Classical,Sicilian Defense,27238,-74,1782.0
96276,1854,B50,Rated Classical game,Sicilian Defense,0-1,Normal,900+15,1730,,,,Classical,Sicilian Defense,27238,-124,1792.0
96300,1819,B40,Rated Classical game,Sicilian Defense: Delayed Alapin Variation,1/2-1/2,Normal,900+15,1851,,,,Classical,Sicilian Defense,27238,32,1835.0
96330,2025,D06,Rated Classical game,Queen's Gambit Refused: Marshall Defense,0-1,Time forfeit,900+15,1783,,,,Classical,Queen's Gambit Declined,2704,-242,1904.0
96345,1732,B22,Rated Classical game,Sicilian Defense: Alapin Variation,0-1,Normal,900+15,1684,,,,Classical,Sicilian Defense,27238,-48,1708.0
96372,1821,D00,Rated Classical game,Queen's Pawn Game: Mason Attack,0-1,Normal,900+15,1846,,,,Classical,Queen's Pawn Game,13096,25,1833.5
96435,1901,A01,Rated Classical game,Nimzo-Larsen Attack: Modern Variation #3,0-1,Normal,900+15,1727,,,,Classical,Nimzo-Larsen Attack,2228,-174,1814.0
96551,1842,B56,Rated Classical game,Sicilian Defense: Classical Variation,0-1,Normal,900+15,1757,,,,Classical,Sicilian Defense,27238,-85,1799.5
96593,1725,C21,Rated Classical game,Center Game #2,1-0,Normal,900+15,1774,,,,Classical,Center Game,1393,49,1749.5
96616,1764,A16,Rated Classical game,"English Opening: Anglo-Indian Defense, Queen's Knight Variation",1-0,Normal,900+15,2117,,,,Classical,English Opening,7494,353,1940.5
96650,1743,A80,Rated Classical game,Dutch Defense,0-1,Normal,300+35,1718,,,,Classical,Dutch Defense,1126,-25,1730.5
96727,1784,A84,Rated Classical game,Dutch Defense,1-0,Normal,1800+30,1780,,,,Classical,Dutch Defense,1126,-4,1782.0
96731,1904,B77,Rated Classical game,"Sicilian Defense: Dragon Variation, Yugoslav Attack, Sosonko Variation",1-0,Normal,900+15,1888,,,,Classical,Sicilian Defense,27238,-16,1896.0
96732,1982,B22,Rated Classical game,"Sicilian Defense: Alapin Variation, Smith-Morra Declined",1-0,Normal,900+15,2029,,,,Classical,Sicilian Defense,27238,47,2005.5
96734,1957,D30,Rated Classical game,Queen's Gambit Declined,1-0,Normal,900+15,1997,,,,Classical,Queen's Gambit Declined,4145,40,1977.0
96794,1753,C21,Rated Classical game,"Danish Gambit Accepted, Classical Defense",1-0,Normal,900+15,1743,,,,Classical,Danish Gambit Accepted,212,-10,1748.0
96799,1950,A05,Rated Classical game,King's Indian Attack: Symmetrical Defense,0-1,Normal,900+15,1948,,,,Classical,King's Indian Attack,802,-2,1949.0
96816,1777,D31,Rated Classical game,Queen's Gambit Declined: Queen's Knight Variation,1-0,Normal,900+15,1705,,,,Classical,Queen's Gambit Declined,4145,-72,1741.0
96858,1683,D00,Rated Classical game,Queen's Pawn Game: Mason Attack,1-0,Normal,900+15,1789,,,,Classical,Queen's Pawn Game,13096,106,1736.0
96878,2023,C50,Rated Classical game,Italian Game,1-0,Normal,900+15,1972,,,,Classical,Italian Game,8617,-51,1997.5
96891,1991,C00,Rated Classical game,French Defense: Horwitz Attack,0-1,Normal,900+15,1808,,,,Classical,French Defense,13036,-183,1899.5
96904,2031,C53,Rated Classical game,"Italian Game: Classical Variation, Albin Gambit",1-0,Normal,900+15,2075,,,,Classical,Italian Game,8617,44,2053.0
96911,1914,C27,Rated Classical game,Vienna Game #2,0-1,Normal,900+15,1628,,,,Classical,Vienna Game,1849,-286,1771.0
97024,1956,A08,Rated Classical game,King's Indian Attack,1-0,Normal,900+15,1889,,,,Classical,King's Indian Attack,802,-67,1922.5
97032,1721,D10,Rated Classical game,Slav Defense: Exchange Variation,1-0,Normal,900+15,1707,,,,Classical,Slav Defense,2437,-14,1714.0
97065,2118,C05,Rated Classical game,"French Defense: Tarrasch Variation, Closed Variation #2",0-1,Normal,900+15,2113,,,,Classical,French Defense,13036,-5,2115.5
97070,1715,A51,Rated Classical game,Indian Game: Budapest Defense,1-0,Normal,900+15,1718,,,,Classical,Indian Game,4090,3,1716.5
97071,1850,B31,Rated Classical game,"Sicilian Defense: Nyezhmetdinov-Rossolimo Attack, Fianchetto Variation",0-1,Normal,900+15,1813,,,,Classical,Sicilian Defense,27238,-37,1831.5
97089,1931,D08,Rated Classical game,"Queen's Gambit Refused: Albin Countergambit, Normal Line",0-1,Normal,1800+2,1927,,,,Classical,Queen's Gambit Declined,2704,-4,1929.0
97194,1773,B01,Rated Classical game,Scandinavian Defense,1-0,Normal,900+15,1777,,,,Classical,Scandinavian Defense,7890,4,1775.0
97195,1658,C64,Rated Classical game,"Ruy Lopez: Classical Variation, Central Variation",0-1,Normal,900+15,1936,,,,Classical,Ruy Lopez,6912,278,1797.0
97216,1646,D06,Rated Classical game,Queen's Gambit Refused: Baltic Defense,1-0,Normal,900+15,1802,,,,Classical,Queen's Gambit Declined,2704,156,1724.0
97237,1893,B20,Rated Classical game,Sicilian Defense: Bowdler Attack,0-1,Normal,1500+5,1710,,,,Classical,Sicilian Defense,27238,-183,1801.5
97244,1743,B03,Rated Classical game,Alekhine Defense #3,1-0,Normal,900+15,1885,,,,Classical,Alekhine Defense,2101,142,1814.0
97301,1841,D30,Rated Classical game,Queen's Gambit Declined,0-1,Normal,900+15,1681,,,,Classical,Queen's Gambit Declined,4145,-160,1761.0
97334,1691,D20,Rated Classical game,Queen's Gambit Accepted,1-0,Normal,900+15,1837,,,,Classical,Queen's Gambit Accepted,2590,146,1764.0
97341,1832,B54,Rated Classical game,Sicilian Defense #2,1-0,Normal,900+15,1754,,,,Classical,Sicilian Defense,27238,-78,1793.0
97358,1848,A10,Rated Classical game,English Opening: Anglo-Scandinavian Defense,1-0,Normal,900+15,1882,,,,Classical,English Opening,7494,34,1865.0
97480,2108,B30,Rated Classical game,Sicilian Defense: Old Sicilian,0-1,Normal,900+15,1880,,,,Classical,Sicilian Defense,27238,-228,1994.0
97515,2200,C10,Rated Classical game,French Defense: Paulsen Variation,1-0,Normal,900+15,2142,,,,Classical,French Defense,13036,-58,2171.0
97539,2072,B25,Rated Classical game,Sicilian Defense: Closed Variation,1-0,Normal,900+15,2019,,,,Classical,Sicilian Defense,27238,-53,2045.5
97565,1834,D02,Rated Classical game,Queen's Pawn Game: Symmetrical Variation,1-0,Normal,900+15,2046,,,,Classical,Queen's Pawn Game,13096,212,1940.0
97764,1703,C65,Rated Classical game,Ruy Lopez: Berlin Defense #2,1-0,Normal,900+15,1740,,,,Classical,Ruy Lopez,6912,37,1721.5
97773,1746,B20,Rated Classical game,Sicilian Defense: Staunton-Cochrane Variation,1-0,Normal,900+15,1727,,,,Classical,Sicilian Defense,27238,-19,1736.5
97921,1964,D37,Rated Classical game,Queen's Gambit Declined: Three Knights Variation,0-1,Normal,900+15,2019,,,,Classical,Queen's Gambit Declined,4145,55,1991.5
97948,1689,C26,Rated Classical game,Vienna Game: Stanley Variation,1-0,Normal,900+15,1773,,,,Classical,Vienna Game,1849,84,1731.0
97956,1769,B13,Rated Classical game,Caro-Kann Defense: Exchange Variation,1-0,Time forfeit,900+15,1947,,,,Classical,Caro-Kann Defense,6878,178,1858.0
97982,1708,D11,Rated Classical game,Slav Defense: Modern,1-0,Normal,900+15,1762,,,,Classical,Slav Defense,2437,54,1735.0
98010,1768,C23,Rated Classical game,Bishop's Opening,1-0,Normal,900+15,1783,,,,Classical,Bishop's Opening,2817,15,1775.5
98023,1858,B20,Rated Classical game,Sicilian Defense: Bowdler Attack,1-0,Normal,900+15,1932,,,,Classical,Sicilian Defense,27238,74,1895.0
98049,1774,E90,Rated Classical game,King's Indian Defense: Larsen Variation,1-0,Normal,900+15,1785,,,,Classical,King's Indian Defense,2170,11,1779.5
98058,1890,C18,Rated Classical game,"French Defense: Winawer Variation, Advance Variation #2",1/2-1/2,Normal,900+15,1949,,,,Classical,French Defense,13036,59,1919.5
98100,1818,A40,Rated Classical game,Mikenas Defense,1/2-1/2,Normal,900+15,1719,,,,Classical,Mikenas Defense,464,-99,1768.5
98117,1754,A45,Rated Classical game,Indian Game,1-0,Normal,900+15,1749,,,,Classical,Indian Game,4090,-5,1751.5
98129,1926,A51,Rated Classical game,Indian Game: Budapest Defense,1-0,Normal,900+15,1909,,,,Classical,Indian Game,4090,-17,1917.5
98148,1750,C62,Rated Classical game,Ruy Lopez: Steinitz Defense,1-0,Normal,900+15,1762,,,,Classical,Ruy Lopez,6912,12,1756.0
98232,1809,C54,Rated Classical game,"Italian Game: Classical Variation, Greco Gambit, Main Line",0-1,Normal,900+15,1744,,,,Classical,Italian Game,8617,-65,1776.5
98255,1787,C11,Rated Classical game,French Defense: Burn Variation,0-1,Normal,900+15,1784,,,,Classical,French Defense,13036,-3,1785.5
98268,1727,D35,Rated Classical game,Queen's Gambit Declined: Normal Defense,0-1,Normal,900+15,1716,,,,Classical,Queen's Gambit Declined,4145,-11,1721.5
98296,1864,C02,Rated Classical game,"French Defense: Advance Variation, Milner-Barry Gambit",1-0,Normal,900+15,2231,,,,Classical,French Defense,13036,367,2047.5
98305,1856,A45,Rated Classical game,Indian Game,0-1,Normal,900+15,1965,,,,Classical,Indian Game,4090,109,1910.5
98326,1985,A08,Rated Classical game,King's Indian Attack,0-1,Normal,900+15,1800,,,,Classical,King's Indian Attack,802,-185,1892.5
98379,1877,C27,Rated Classical game,Bishop's Opening: Boden-Kieseritzky Gambit,0-1,Normal,1800+0,1780,,,,Classical,Bishop's Opening,2817,-97,1828.5
98421,2054,C02,Rated Classical game,"French Defense: Advance Variation, Nimzowitsch System",0-1,Time forfeit,900+15,1917,,,,Classical,French Defense,13036,-137,1985.5
98445,2135,A84,Rated Classical game,"Horwitz Defense: Dutch Defense, Bellon Gambit",1-0,Normal,1200+10,2045,,,,Classical,Horwitz Defense,2191,-90,2090.0
98456,1685,A00,Rated Classical game,Hungarian Opening,0-1,Normal,900+15,1730,,,,Classical,Hungarian Opening,2313,45,1707.5
98470,2080,B23,Rated Classical game,Sicilian Defense: Closed #2,0-1,Normal,900+15,2076,,,,Classical,Sicilian Defense,27238,-4,2078.0
98522,1730,A10,Rated Classical game,English Opening,1-0,Normal,900+15,1735,,,,Classical,English Opening,7494,5,1732.5
98542,1719,A25,Rated Classical game,"English Opening: King's English Variation, Reversed Closed Sicilian",1-0,Time forfeit,900+15,1746,,,,Classical,English Opening,7494,27,1732.5
98546,1778,B21,Rated Classical game,Sicilian Defense: Smith-Morra Gambit,0-1,Normal,900+15,1867,,,,Classical,Sicilian Defense,27238,89,1822.5
98558,1746,E61,Rated Classical game,King's Indian Defense,0-1,Normal,900+15,1691,,,,Classical,King's Indian Defense,2170,-55,1718.5
98626,1682,D53,Rated Classical game,Queen's Gambit Declined: 4.Bg5 Be7,1-0,Normal,900+15,1740,,,,Classical,Queen's Gambit Declined,4145,58,1711.0
98689,1774,A00,Rated Classical game,Polish Opening,1-0,Normal,900+15,1763,,,,Classical,Polish Opening,733,-11,1768.5
98695,1902,D44,Rated Classical game,Semi-Slav Defense: Botvinnik Variation,0-1,Normal,900+15,1886,,,,Classical,Semi-Slav Defense,1054,-16,1894.0
98768,1860,E61,Rated Classical game,King's Indian Defense,0-1,Normal,900+15,1677,,,,Classical,King's Indian Defense,2170,-183,1768.5
98769,1892,D10,Rated Classical game,Slav Defense #2,1-0,Normal,900+15,1957,,,,Classical,Slav Defense,2437,65,1924.5
98804,2040,C22,Rated Classical game,Center Game: Berger Variation,0-1,Normal,900+15,1932,,,,Classical,Center Game,1393,-108,1986.0
98850,1715,C10,Rated Classical game,French Defense: Paulsen Variation,1-0,Time forfeit,900+15,1716,,,,Classical,French Defense,13036,1,1715.5
98859,2036,C12,Rated Classical game,"French Defense: MacCutcheon Variation, Chigorin Variation",0-1,Normal,900+15,1849,,,,Classical,French Defense,13036,-187,1942.5
98867,1893,B95,Rated Classical game,Sicilian Defense: Najdorf Variation,0-1,Normal,900+15,1643,,,,Classical,Sicilian Defense,27238,-250,1768.0
99008,1514,C41,Rated Classical game,Philidor Defense: Exchange Variation #2,1-0,Normal,1800+0,2009,,,,Classical,Philidor Defense,5391,495,1761.5
99033,1950,D00,Rated Classical game,Queen's Pawn Game: Steinitz Countergambit,0-1,Normal,900+15,1759,,,,Classical,Queen's Pawn Game,13096,-191,1854.5
99091,1767,C66,Rated Classical game,"Ruy Lopez: Berlin Defense, Improved Steinitz Defense",1-0,Normal,900+15,1726,,,,Classical,Ruy Lopez,6912,-41,1746.5
99104,1711,C00,Rated Classical game,French Defense: Réti-Spielmann Attack,0-1,Normal,900+15,1768,,,,Classical,French Defense,13036,57,1739.5
99165,2014,B11,Rated Classical game,Caro-Kann Defense,0-1,Normal,900+15,1874,,,,Classical,Caro-Kann Defense,6878,-140,1944.0
99173,1701,C62,Rated Classical game,Ruy Lopez: Steinitz Defense,1-0,Normal,900+15,1875,,,,Classical,Ruy Lopez,6912,174,1788.0
99275,1800,B20,Rated Classical game,Sicilian Defense: Bowdler Attack,0-1,Normal,900+15,1699,,,,Classical,Sicilian Defense,27238,-101,1749.5
99326,1956,B07,Rated Classical game,Pirc Defense #4,1-0,Normal,900+15,2084,,,,Classical,Pirc Defense,2814,128,2020.0
99462,1852,A42,Rated Classical game,Sicilian Defense: Hyperaccelerated Fianchetto,1-0,Normal,900+15,1798,,,,Classical,Sicilian Defense,27238,-54,1825.0
99464,1688,C44,Rated Classical game,Scotch Game,0-1,Normal,900+15,1821,,,,Classical,Scotch Game,4227,133,1754.5
99499,1731,C57,Rated Classical game,"Italian Game: Two Knights Defense, Fried Liver Attack",1-0,Normal,900+15,1759,,,,Classical,Italian Game,8617,28,1745.0
99574,1762,C44,Rated Classical game,Scotch Game: Scotch Gambit,0-1,Time forfeit,900+15,1663,,,,Classical,Scotch Game,4227,-99,1712.5
99591,1924,C42,Rated Classical game,Petrov's Defense,0-1,Normal,900+15,1828,,,,Classical,Petrov Defense,832,-96,1876.0
99595,1724,C15,Rated Classical game,French Defense: Winawer Variation,1-0,Normal,900+15,1719,,,,Classical,French Defense,13036,-5,1721.5
99656,1895,D45,Rated Classical game,Semi-Slav Defense: Main Line,1-0,Normal,2100+30,1807,,,,Classical,Semi-Slav Defense,1054,-88,1851.0
99724,1708,C52,Rated Classical game,"Italian Game: Evans Gambit, Compromised Defense",1-0,Normal,900+15,1852,,,,Classical,Italian Game,8617,144,1780.0
99781,1864,D02,Rated Classical game,Queen's Pawn Game: London System,1-0,Normal,900+15,1853,,,,Classical,Queen's Pawn Game,13096,-11,1858.5
99789,1813,B02,Rated Classical game,Alekhine Defense: Sämisch Attack,1-0,Time forfeit,1500+25,1861,,,,Classical,Alekhine Defense,2101,48,1837.0
99822,1792,C26,Rated Classical game,Vienna Game: Falkbeer Variation,0-1,Normal,900+15,1762,,,,Classical,Vienna Game,1849,-30,1777.0
99845,1672,C64,Rated Classical game,Ruy Lopez: Classical Variation,1-0,Normal,900+15,1812,,,,Classical,Ruy Lopez,6912,140,1742.0
99880,1703,B32,Rated Classical game,Sicilian Defense: Loewenthal Variation,1-0,Normal,900+15,1889,,,,Classical,Sicilian Defense,27238,186,1796.0
99888,1941,A46,Rated Classical game,Torre Attack #2,1-0,Normal,900+15,2079,,,,Classical,Torre Attack,394,138,2010.0
99928,1841,D00,Rated Classical game,Queen's Pawn Game: Mason Attack,0-1,Normal,900+15,1819,,,,Classical,Queen's Pawn Game,13096,-22,1830.0
99983,1743,C22,Rated Classical game,Center Game: Hall Variation,0-1,Normal,900+15,1658,,,,Classical,Center Game,1393,-85,1700.5
100035,2171,C58,Rated Classical game,"Italian Game: Two Knights Defense, Blackburne Variation",0-1,Normal,1500+3,2006,,,,Classical,Italian Game,8617,-165,2088.5
100039,1857,B00,Rated Classical game,St. George Defense,0-1,Normal,900+15,1794,,,,Classical,St. George Defense,339,-63,1825.5
100058,1759,C00,Rated Classical game,French Defense: La Bourdonnais Variation,1-0,Normal,900+15,1822,,,,Classical,French Defense,13036,63,1790.5
100061,1805,A36,Rated Classical game,"English Opening: Symmetrical Variation, Symmetrical Variation",0-1,Normal,900+15,1701,,,,Classical,English Opening,7494,-104,1753.0
100098,2186,B72,Rated Classical game,"Sicilian Defense: Dragon, 6.Be3",0-1,Normal,900+15,1918,,,,Classical,Sicilian Defense,27238,-268,2052.0
100106,1912,B27,Rated Classical game,Sicilian Defense: Hyperaccelerated Pterodactyl,1-0,Normal,900+15,1899,,,,Classical,Sicilian Defense,27238,-13,1905.5
100158,1965,C45,Rated Classical game,Scotch Game: Potter Variation,1-0,Normal,900+15,2399,,,,Classical,Scotch Game,4227,434,2182.0
100183,1688,B01,Rated Classical game,Scandinavian Defense,0-1,Normal,900+15,1754,,,,Classical,Scandinavian Defense,7890,66,1721.0
100185,1874,A80,Rated Classical game,Dutch Defense,0-1,Normal,900+15,1626,,,,Classical,Dutch Defense,1126,-248,1750.0
100195,1785,B06,Rated Classical game,Robatsch (Modern) Defense,0-1,Normal,900+15,1700,,,,Classical,Robatsch (Modern) Defense,867,-85,1742.5
100272,1955,A06,Rated Classical game,Nimzowitsch-Larsen Attack,1-0,Normal,900+15,1927,,,,Classical,Nimzowitsch-Larsen Attack,143,-28,1941.0
100290,2024,A22,Rated Classical game,"English Opening: King's English Variation, Two Knights Variation",1/2-1/2,Normal,900+15,1878,,,,Classical,English Opening,7494,-146,1951.0
100311,1755,B30,Rated Classical game,Sicilian Defense: Nyezhmetdinov-Rossolimo Attack,1-0,Normal,900+15,1930,,,,Classical,Sicilian Defense,27238,175,1842.5
100315,1729,A00,Rated Classical game,Hungarian Opening,1-0,Normal,900+15,1816,,,,Classical,Hungarian Opening,2313,87,1772.5
100365,1795,C63,Rated Classical game,Ruy Lopez: Schliemann Defense,1-0,Normal,900+15,1735,,,,Classical,Ruy Lopez,6912,-60,1765.0
100380,1747,B30,Rated Classical game,Sicilian Defense: Old Sicilian,1-0,Normal,2400+15,1834,,,,Classical,Sicilian Defense,27238,87,1790.5
100444,1891,B01,Rated Classical game,Scandinavian Defense: Icelandic-Palme Gambit,0-1,Time forfeit,900+15,1818,,,,Classical,Scandinavian Defense,7890,-73,1854.5
100448,1983,B21,Rated Classical game,Sicilian Defense: McDonnell Attack,1-0,Normal,900+15,2034,,,,Classical,Sicilian Defense,27238,51,2008.5
100456,1815,B30,Rated Classical game,Sicilian Defense: Nyezhmetdinov-Rossolimo Attack,0-1,Normal,900+15,1842,,,,Classical,Sicilian Defense,27238,27,1828.5
100469,2218,B00,Rated Classical game,"Nimzowitsch Defense: Kennedy Variation, Paulsen Attack",1-0,Normal,1500+0,1881,LM,,,Classical,Nimzowitsch Defense,2364,-337,2049.5
100479,1900,D27,Rated Classical game,"Queen's Gambit Accepted: Classical Defense, Rubinstein Variation",1/2-1/2,Normal,900+15,1954,,,,Classical,Queen's Gambit Accepted,2590,54,1927.0
100520,1753,C44,Rated Classical game,"Scotch Game: Scotch Gambit, Dubois Réti Defense",0-1,Normal,900+15,1815,,,,Classical,Scotch Game,4227,62,1784.0
100528,1858,C47,Rated Classical game,Four Knights Game: Scotch Variation Accepted,1-0,Time forfeit,1800+0,1710,,,,Classical,Four Knights Game,3524,-148,1784.0
100531,1414,C07,Rated Classical game,"French Defense: Tarrasch Variation, Open System",1-0,Normal,900+15,2148,,,,Classical,French Defense,13036,734,1781.0
100599,1821,B00,Rated Classical game,Owen Defense,1-0,Time forfeit,900+15,1783,,,,Classical,Owen Defense,1829,-38,1802.0
100630,1740,B01,Rated Classical game,Scandinavian Defense,1-0,Normal,900+15,1788,,,,Classical,Scandinavian Defense,7890,48,1764.0
100764,1751,A40,Rated Classical game,Queen's Pawn,0-1,Normal,900+15,1818,,,,Classical,Queen's Pawn Game,1407,67,1784.5
100806,1735,D10,Rated Classical game,Slav Defense: Exchange Variation,0-1,Normal,900+15,1800,,,,Classical,Slav Defense,2437,65,1767.5
100816,1992,C55,Rated Classical game,"Italian Game: Giuoco Piano, Holzhausen Attack",1-0,Normal,1500+0,1888,,,,Classical,Italian Game,8617,-104,1940.0
100819,2136,B57,Rated Classical game,"Sicilian Defense: Sozin, not Scheveningen",1-0,Normal,900+15,1920,,,,Classical,Sicilian Defense,27238,-216,2028.0
100820,1833,B32,Rated Classical game,Sicilian Defense: Nimzo-American Variation,1-0,Normal,1500+25,1975,,,,Classical,Sicilian Defense,27238,142,1904.0
100870,2045,B03,Rated Classical game,"Alekhine Defense: Four Pawns Attack, 6...Nc6",1/2-1/2,Normal,900+15,2031,,,,Classical,Alekhine Defense,2101,-14,2038.0
100920,2097,B88,Rated Classical game,"Sicilian Defense: Sozin Attack, Leonhardt Variation",0-1,Normal,900+15,1864,,,,Classical,Sicilian Defense,27238,-233,1980.5
100954,1751,D00,Rated Classical game,Queen's Pawn Game,1-0,Normal,900+15,1758,,,,Classical,Queen's Pawn Game,13096,7,1754.5
101000,1798,C00,Rated Classical game,French Defense: Knight Variation,1/2-1/2,Normal,900+15,1930,,,,Classical,French Defense,13036,132,1864.0
101028,1906,B30,Rated Classical game,Sicilian Defense: Nyezhmetdinov-Rossolimo Attack,1-0,Normal,900+15,2091,,,,Classical,Sicilian Defense,27238,185,1998.5
101033,1917,D70,Rated Classical game,"Indian Game: Anti-Grünfeld, Alekhine Variation",1-0,Time forfeit,900+15,1974,,,,Classical,Indian Game,4090,57,1945.5
101064,1821,B01,Rated Classical game,Scandinavian Defense: Mieses-Kotroc Variation,1-0,Normal,900+15,1966,,,,Classical,Scandinavian Defense,7890,145,1893.5
101090,1871,B50,Rated Classical game,Sicilian Defense,0-1,Normal,900+15,1802,,,,Classical,Sicilian Defense,27238,-69,1836.5
101106,1665,B29,Rated Classical game,"Sicilian Defense: Nimzowitsch Variation, Closed Variation",1-0,Normal,900+15,1861,,,,Classical,Sicilian Defense,27238,196,1763.0
101107,2124,C41,Rated Classical game,Philidor Defense: Exchange Variation,0-1,Normal,900+15,1814,,,,Classical,Philidor Defense,5391,-310,1969.0
101134,1702,D00,Rated Classical game,Blackmar-Diemer Gambit: Ryder Gambit,1-0,Normal,900+15,1723,,,,Classical,Blackmar-Diemer Gambit,631,21,1712.5
101149,1835,D55,Rated Classical game,Queen's Gambit Declined: Anti-Tartakower Variation,0-1,Normal,900+15,1856,,,,Classical,Queen's Gambit Declined,4145,21,1845.5
101257,1748,C00,Rated Classical game,French Defense: Knight Variation,0-1,Normal,900+15,1830,,,,Classical,French Defense,13036,82,1789.0
